{
  "submissionId": "LIVE-0002-HVAC-COMPRESSOR",
  "customer": {
    "email": "sarah.mitchell@example.com",
    "name": "Sarah Mitchell"
  },
  "equipment": {
    "type": "hvac",
    "make": "Carrier",
    "model": "Infinity 18",
    "year": "2019"
  },
  "symptoms": "Central AC not cooling properly; runs continuously, house temperature stuck at 78°F (set to 72°F). Condenser running but quieter than usual. No ice. Serviced 6 months ago (refrigerant top-off). Energy bills up 30%.",
  "codes": [
    "E1"
  ],
  "root_cause_hypotheses": [
    {
      "hypothesis": "Refrigerant leak",
      "evidence": "Previous top-off, reduced cooling, increased energy bills.",
      "likelihood": "high"
    },
    {
      "hypothesis": "Compressor failure",
      "evidence": "Reduced cooling capacity, quieter operation.",
      "likelihood": "medium"
    },
    {
      "hypothesis": "Condenser coil blockage",
      "evidence": "Reduced airflow, inefficient cooling.",
      "likelihood": "low"
    }
  ],
  "most_likely_cause": "Refrigerant leak is the most likely cause, leading to reduced cooling capacity and increased energy consumption.",
  "recommended_actions": [
    {
      "step": "Refrigerant leak test: Use electronic leak detector and bubble solution on all connections.",
      "why": "Pinpoint and confirm the location of any refrigerant leaks."
    },
    {
      "step": "Repair leaks: Seal or replace leaking components.",
      "why": "Prevent further refrigerant loss."
    },
    {
      "step": "Evacuate and recharge system: Follow manufacturer's specifications.",
      "why": "Restore proper refrigerant charge and cooling performance."
    },
    {
      "step": "Monitor system pressures and temperatures: Verify proper operation after recharge.",
      "why": "Ensure system is functioning correctly."
    }
  ],
  "tools_parts": [
    "Electronic leak detector",
    "Bubble solution",
    "Refrigerant",
    "Vacuum pump",
    "Manifold gauge set",
    "Nitrogen",
    "Wrench set"
  ],
  "safety_notes": [
    "Wear appropriate personal protective equipment (PPE) when handling refrigerant.",
    "Ensure proper ventilation when working with refrigerant.",
    "Recover refrigerant properly to prevent environmental damage.",
    "Do not overcharge the system with refrigerant.",
    "Depressurize system before repairing any components."
  ],
  "estimated_cost_range_usd": {
    "low": 300,
    "high": 1200
  },
  "estimated_time_hours": 6,
  "warranty_or_tsb_refs": [],
  "disclaimers": [
    "Cost and time estimates are approximate and may vary based on the specific leak location and parts required.",
    "E1 is a generic error code; further diagnostics are needed for confirmation."
  ],
  "confidence": {
    "score_pct": 80,
    "threshold_pct": 85,
    "assessment": "Insufficient data to achieve target confidence. Further diagnostics are needed to confirm the leak and compressor health."
  },
  "confidence_uplift_requirements": [
    "Refrigerant type and pressures (suction/discharge)",
    "Subcooling and superheat measurements",
    "Compressor amperage draw",
    "Leak test results showing leak location"
  ],
  "customer_readiness_check": {
    "verdict": "needs_revision",
    "short_reason": "Confidence is below threshold; needs refrigerant pressure readings and leak test confirmation for high confidence recommendation."
  }
}