{
  "submissionId": "diag_mock_A",
  "customer": {
    "email": "driver.a@example.com",
    "name": "Alex Rivera"
  },
  "equipment": {
    "type": "vehicle",
    "make": "Toyota",
    "model": "Camry",
    "year": "2018"
  },
  "symptoms": "MIL on, reduced power under load, noticeable rough idle after cold start.",
  "codes": [
    "P0301",
    "P0171"
  ],
  "root_cause_hypotheses": [
    {
      "hypothesis": "Ignition coil failure on cylinder 1",
      "evidence": "P0301 code indicates consistent misfire pattern; common failure mode for high-mileage engines",
      "likelihood": "high"
    },
    {
      "hypothesis": "Fuel injector clog or electrical fault",
      "evidence": "Could explain single-cylinder misfire if injector stuck closed or driver circuit failed",
      "likelihood": "medium"
    },
    {
      "hypothesis": "Compression loss due to valve or ring failure",
      "evidence": "Would show consistent misfire but typically accompanied by reduced power and smoke",
      "likelihood": "low"
    }
  ],
  "most_likely_cause": "Ignition coil failure on cylinder 1, likely due to heat stress and high mileage. P0301 code confirms consistent misfire pattern.",
  "recommended_actions": [
    {
      "step": "Swap ignition coil from cylinder 1 to another cylinder",
      "why": "If misfire follows the coil, confirms coil failure; cheapest diagnostic step"
    },
    {
      "step": "Check fuel injector resistance and spray pattern",
      "why": "Rules out fuel delivery issue before replacing ignition components"
    },
    {
      "step": "Perform compression test on cylinder 1",
      "why": "Establishes baseline compression to rule out mechanical failure"
    },
    {
      "step": "Scan for pending codes and freeze-frame data",
      "why": "Captures engine conditions when misfire occurred for better diagnosis"
    }
  ],
  "tools_parts": [
    "OBD-II scanner with live data capability",
    "Ignition coil (OEM or equivalent)",
    "Spark plug socket and torque wrench",
    "Compression tester kit",
    "Fuel pressure gauge",
    "Multimeter for resistance testing"
  ],
  "safety_notes": [
    "Disconnect battery negative terminal before working on ignition system",
    "Allow engine to cool before removing ignition components",
    "Wear eye protection when releasing fuel system pressure",
    "Use proper jack stands if raising vehicle; never rely on jack alone"
  ],
  "estimated_cost_range_usd": {
    "low": 120,
    "high": 450
  },
  "estimated_time_hours": 2.5,
  "warranty_or_tsb_refs": [
    "Ford TSB 08-7-6: Ignition coil failures on 5.4L engines (2004-2008)",
    "Check warranty coverage if under 60,000 miles (powertrain)",
    "Motorcraft DG508 coil is OEM replacement part"
  ],
  "disclaimers": [
    "This analysis is based on provided symptoms and codes; physical inspection may reveal additional issues",
    "Cost estimates are regional averages; actual prices vary by location and shop labor rates",
    "Always request written estimates before authorizing repairs",
    "Second opinion recommended for repairs exceeding $500"
  ],
  "confidence": {
    "score_pct": 72,
    "threshold_pct": 85,
    "assessment": "Moderate confidence based on code pattern; coil swap test would increase to 95%+ certainty."
  },
  "confidence_uplift_requirements": [
    "Freeze-frame data for P0301 showing engine RPM, load, and coolant temp",
    "Ignition coil swap test results (does misfire follow the coil?)",
    "Fuel trim data for all cylinders to rule out fuel delivery issues",
    "Compression test results for cylinder 1 compared to other cylinders",
    "Exact VIN and mileage for TSB applicability check"
  ],
  "customer_readiness_check": {
    "verdict": "needs_revision",
    "short_reason": "Insufficient diagnostic data; need freeze-frame and coil swap results"
  },
  "meta": {
    "model": "mock-vertex-offline",
    "version": "1.0.0",
    "generated_at_iso": "2025-10-15T21:56:01.545610Z"
  }
}
